ID,Numero,Codigo_Producto,Nombre,Categoria,Subcategoria,Slug,Imagen,PDF_Ficha,Descripcion_Corta,Descripcion_Larga,Marca,Disponibilidad,Destacado,Tags,Beneficios,Presentacion,Especificaciones,Palabras_Clave,Fecha_Actualizacion
"40","40","PB004","HATCHERY PRIME","probioticos","Especializados","hatchery-prime","/assets/images/productos/probioticos/PB004.png","/assets/pdfs/productos/probioticos/PB004_HATCHERY_PRIME_ficha.pdf","Objecto de biorremediación para criaderos de acuicultura.","Es un producto de biorremediación utilizado en los criaderos de acuicultura para mejorar la calidad del agua y reducir los patógenos que alteran las condiciones del ambiente, estimulando el crecimiento de microorganismos para degradar contaminantes.","PRILABSA","InStock","false","probioticos; acuicultura; prilabsa; especializados","Disminuye amoníaco para mejorar la calidad del agua; Inhíbe, suprime y excluye competitivamente las bacterias patógenas, incluido el Vibrio; Contiene bacterias esporuladas no patógenas para garantizar altas concentraciones de bacterias vivas; Se puede aplicar durante la preparación o con poblaciones de organismos (camarones o peces); Actúa en agua dulce, salobre y salada","Tachos de 3kg, tabletas de 3gr de color blanco-amarillento; Almacenar en un lugar fresco, seco, bien ventilado, no exponer a la luz solar y alejarlo de las paredes; No requiere de Refrigeración; No requiere condiciones especiales de transporte; Para uso en acuacultura, para mejorar la calidad del agua y reducir los patógenos; No apto para consumo humano","Concentración: 10% UFC; Conteo de bacterias: 1.00 x 10⁹ ufc/g; Bacillus amyloliquefaciens: 1.00 x 10⁹ ufc/g; Bacillus licheniformis: 1.00 x 10⁹ ufc/g; Bacillus polymyxa: 1.00 x 10⁹ ufc/g; Bacillus pumilus: 2.00 x 10⁹ ufc/g; Carrier: 90% Cloruro de sodio; Conteo total de bacterias: 5.00 x 10⁹ ufc/g; pH: Neutro; Rango eficaz del pH: 5.8 - 10.5; Tiempo de vida útil: 5.8 - 10.5; Temperatura eficaz: 10 - 30°C","probioticos; camarones; especializados; acuicultura; prilabsa","2025-07-19T17:20:20.055278"
"41","41","QU015","CLORO GRANULADO","quimicos","Desinfectantes","cloro-granulado","/assets/images/productos/quimicos/QU015.png","/assets/pdfs/productos/quimicos/QU015_CLORO_GRANULADO_ficha.pdf","Desinfectante de amplio espectro con un 70% de pureza, utilizado como parte de los programas de bioseguridad.","Desinfectante de amplio espectro con un 70% de pureza, utilizado como parte de los programas de bioseguridad en laboratorios, criaderos, camaroneras y empacadoras.","PRILABSA","InStock","false","quimicos; acuicultura; prilabsa","Elimina eficazmente microorganismos patógenos.; Favorece programas de bioseguridad en centros de producción acuícola.; Previene brotes de enfermedades antes de la siembra de postlarvas.; Ideal para limpieza profunda de superficies, equipos y sistemas hidráulicos.","Almacenamiento:; Guardar en lugar seco y ventilado.; Mantener en su empaque original, alejado de la luz solar directa.; Evitar el contacto con materiales combustibles y fuentes de ignición.","Forma: Granulado; Concentración activa: 70%; Aplicación: Disolución en agua para uso externo; Color: Blanco; Olor: Clorado","camarones; desinfectantes; quimicos; acuicultura; prilabsa","2025-07-19T17:20:19.839292"
"42","42","QU004","PERÓXIDO DE HIDRÓGENO","quimicos","Oxidantes","peroxido-de-hidrogeno","/assets/images/productos/quimicos/QU004.png","/assets/pdfs/productos/quimicos/QU004_PEROXIDO_DE_HIDROGENO_ficha.pdf","Agente oxidante utilizado para el tratamiento de agua en acuicultura.","Agente oxidante utilizado para el tratamiento de agua en acuicultura, efectivo contra bacterias, virus y hongos.","PRILABSA","InStock","false","quimicos; acuicultura; prilabsa","Potente agente oxidante y desinfectante.; Efectivo contra bacterias, virus y hongos.; Se descompone en agua y oxígeno, no deja residuos tóxicos.; Mejora los niveles de oxígeno disuelto en el agua.","Presentación:; Bidones de 25 kg.; Almacenamiento:; Mantener en lugar fresco, seco y ventilado.; Evitar el contacto con materiales orgánicos y metales.","Concentración: 35%; Forma: Líquido; Color: Incoloro; pH: Ácido (2-4); Densidad: 1.13 g/cm³","camarones; oxidantes; quimicos; acuicultura; prilabsa","2025-07-19T17:20:19.839292"
"43","43","QU006","ÁCIDO HÚMICO","quimicos","General","acido-humico","/assets/images/productos/quimicos/QU006.png","/assets/pdfs/productos/quimicos/QU006_NITRATO_DE_SODIO_ficha.pdf","Ácido orgánico natural que mejora la calidad del agua.","Ácido orgánico natural que mejora la calidad del agua y estimula el crecimiento de organismos acuáticos.","PRILABSA","InStock","false","quimicos; acuicultura; prilabsa","Mejora la calidad del agua.; Estimula el crecimiento de organismos acuáticos.; Reduce el estrés en los organismos.; Actúa como quelante natural de metales pesados.","Presentación:; Sacos de 25 kg.; Almacenamiento:; Mantener en lugar seco y ventilado.; Evitar la humedad.","Concentración: 85%; Forma: Polvo; Color: Negro; Solubilidad: Soluble en agua alcalina; pH: 4-6","camarones; general; quimicos; acuicultura; prilabsa","2025-07-19T17:20:19.839292"
"44","44","QU009","ÁCIDO FÓRMICO","quimicos","General","acido-formico","/assets/images/productos/quimicos/QU009.png","/assets/pdfs/productos/quimicos/QU009_ACIDO_FORMICO_ficha.pdf","Ácido orgánico utilizado como acidificante y conservante.","Ácido orgánico utilizado como acidificante y conservante en la industria acuícola.","PRILABSA","InStock","false","quimicos; acuicultura; prilabsa","Efectivo acidificante para ajuste de pH.; Propiedades antimicrobianas.; Mejora la digestibilidad de alimentos.; Conservante natural.","Presentación:; Bidones de 25 kg.; Almacenamiento:; Mantener en lugar fresco y ventilado.; Evitar el contacto con metales.","Concentración: 85%; Forma: Líquido; Color: Incoloro; Densidad: 1.22 g/cm³; pH: Ácido (1.8)","camarones; general; quimicos; acuicultura; prilabsa","2025-07-19T17:20:19.839292"
"45","45","QU008","ÁCIDO NÍTRICO","quimicos","General","acido-nitrico","/assets/images/productos/quimicos/QU008.png","/assets/pdfs/productos/quimicos/QU008_ACIDO_HUMICO_ficha.pdf","Ácido inorgánico fuerte utilizado para limpieza y desinfección.","Ácido inorgánico fuerte utilizado para limpieza y desinfección de equipos en acuicultura.","PRILABSA","InStock","false","quimicos; acuicultura; prilabsa","Potente agente de limpieza.; Efectivo para remoción de incrustaciones.; Desinfectante de equipos.; Elimina biofilms y depósitos minerales.","Presentación:; Bidones de 25 kg.; Almacenamiento:; Mantener en lugar fresco, seco y ventilado.; Evitar el contacto con materiales orgánicos.","Concentración: 65%; Forma: Líquido; Color: Incoloro a amarillo pálido; Densidad: 1.40 g/cm³; pH: Muy ácido (<1)","camarones; general; quimicos; acuicultura; prilabsa","2025-07-19T17:20:19.839292"
"46","46","QU010","ORTHOTOLIDINE (OTO)","quimicos","General","orthotolidine-oto","/assets/images/productos/quimicos/QU010.png","/assets/pdfs/productos/quimicos/QU010_ACIDO_NITRICO_ficha.pdf","Reactivo químico para determinación colorimétrica de cloro libre.","Reactivo químico utilizado para la determinación colorimétrica de cloro libre en agua.","PRILABSA","InStock","false","quimicos; acuicultura; prilabsa","Determinación precisa de cloro libre.; Método colorimétrico simple.; Resultados rápidos y confiables.; Esencial para control de calidad del agua.","Presentación:; Frascos de 100g.; Almacenamiento:; Mantener en lugar seco y oscuro.; Evitar la exposición a la luz.","Pureza: ≥98%; Forma: Polvo cristalino; Color: Blanco a amarillo pálido; Solubilidad: Soluble en alcohol; Punto de fusión: 129-131°C","camarones; general; quimicos; acuicultura; prilabsa","2025-07-19T17:20:19.839292"
"47","47","QU011","FORMALDEHÍDO (FORMOL)","quimicos","Desinfectantes","formaldehido-formol","/assets/images/productos/quimicos/QU011.png","/assets/pdfs/productos/quimicos/QU011_FORMALDEHIDO_FORMOL_ficha.pdf","Desinfectante potente al 37% contra virus, bacterias y parásitos.","Formaldehído al 37% utilizado como desinfectante potente contra virus, bacterias y parásitos. Requiere manejo especializado por personal capacitado debido a su alta efectividad y características químicas.","PRILABSA","InStock","false","quimicos; acuicultura; prilabsa","Desinfectante de amplio espectro altamente efectivo.; Elimina virus, bacterias y parásitos.; Acción rápida y potente.; Esencial para bioseguridad en acuicultura.","Presentación:; Bidones de 25 litros.; Almacenamiento:; Mantener en lugar fresco y ventilado.; Requiere manejo especializado.","Concentración: 37%; Forma: Líquido; Color: Incoloro; Densidad: 1.08 g/cm³; pH: Ácido (2.8-4.0)","camarones; desinfectantes; quimicos; acuicultura; prilabsa","2025-07-19T17:20:19.839292"
"48","48","QU013","PERCARBONATO DE SODIO","quimicos","Oxidantes","percarbonato-de-sodio","/assets/images/productos/quimicos/QU013.png","/assets/pdfs/productos/quimicos/QU013_PERCARBONATO_DE_SODIO_ficha.pdf","Agente oxidante ecológico que libera oxígeno activo.","Agente oxidante ecológico que libera oxígeno activo, utilizado para oxigenación y desinfección.","PRILABSA","InStock","false","quimicos; acuicultura; prilabsa","Libera oxígeno activo de forma controlada.; Agente oxidante ecológico.; Mejora la oxigenación del agua.; Desinfectante suave y efectivo.","Presentación:; Sacos de 25 kg.; Almacenamiento:; Mantener en lugar seco y fresco.; Evitar el contacto con materiales combustibles.","Contenido de oxígeno activo: 13.5%; Forma: Granulado; Color: Blanco; Solubilidad: Soluble en agua; pH (solución 1%): 10.5-11.5","camarones; oxidantes; quimicos; acuicultura; prilabsa","2025-07-19T17:20:19.839292"
"49","49","QU007","TRILON B - EDTA","quimicos","Quelantes","trilon-b-edta","/assets/images/productos/quimicos/QU007.png","/assets/pdfs/productos/quimicos/QU007_TRILON_B_-_EDTA_ficha.pdf","Agente quelante para secuestrar metales pesados.","Agente quelante utilizado para secuestrar metales pesados y mejorar la calidad del agua.","PRILABSA","InStock","false","quimicos; acuicultura; prilabsa","Secuestra metales pesados del agua.; Mejora la calidad del agua.; Previene la precipitación de minerales.; Estabiliza soluciones químicas.","Presentación:; Sacos de 25 kg.; Almacenamiento:; Mantener en lugar seco y ventilado.; Evitar la humedad.","Pureza: ≥99%; Forma: Polvo cristalino; Color: Blanco; Solubilidad: Ligeramente soluble en agua; pH (solución 1%): 4.3-4.8","camarones; quelantes; quimicos; acuicultura; prilabsa","2025-07-19T17:20:19.839292"
"50","50","QU012","EDTA (4Na)","quimicos","Quelantes","edta-4na","/assets/images/productos/quimicos/QU012.png","/assets/pdfs/productos/quimicos/QU012_EDTA_4Na_ficha.pdf","Sal tetrasódica del EDTA, agente quelante altamente soluble.","Sal tetrasódica del EDTA, agente quelante altamente soluble para tratamiento de agua.","PRILABSA","InStock","false","quimicos; acuicultura; prilabsa","Alta solubilidad en agua.; Quelante efectivo de metales pesados.; Mejora la biodisponibilidad de nutrientes.; Estabiliza formulaciones químicas.","Presentación:; Sacos de 25 kg.; Almacenamiento:; Mantener en lugar seco y ventilado.; Evitar la humedad.","Pureza: ≥99%; Forma: Polvo cristalino; Color: Blanco; Solubilidad: Altamente soluble en agua; pH (solución 1%): 10.5-11.5","camarones; quelantes; quimicos; acuicultura; prilabsa","2025-07-19T17:20:19.839292"
"51","51","QU014","REFRIGERANTE ECOLÓGICO R507","quimicos","Refrigerantes","refrigerante-ecologico-r507","/assets/images/productos/quimicos/QU014.png","/assets/pdfs/productos/quimicos/QU014_REFRIGERANTE_ECOLOGICO_R507_ficha.pdf","Refrigerante ecológico para sistemas de refrigeración.","Refrigerante ecológico utilizado en sistemas de refrigeración para conservación de productos acuícolas.","PRILABSA","InStock","false","quimicos; acuicultura; prilabsa","Refrigerante ecológico sin CFC.; No daña la capa de ozono.; Alta eficiencia energética.; Ideal para conservación de productos acuícolas.","Presentación:; Cilindros de 11.3 kg.; Almacenamiento:; Mantener en lugar fresco y ventilado.; Evitar la exposición a altas temperaturas.","Composición: HFC-125/HFC-143a (50/50); Potencial de agotamiento del ozono: 0; Potencial de calentamiento global: 3985; Temperatura de ebullición: -46.7°C; Presión crítica: 37.1 bar","camarones; refrigerantes; quimicos; acuicultura; prilabsa","2025-07-19T17:20:19.839292"
"52","52","QU001","CLORURO DE MAGNESIO","quimicos","Sales","cloruro-de-magnesio","/assets/images/productos/quimicos/QU001.png","/assets/pdfs/productos/quimicos/QU001_CLORURO_DE_MAGNESIO_ficha.pdf","Sal mineral para ajuste de dureza y suplementación de magnesio.","Sal mineral utilizada para ajuste de dureza y suplementación de magnesio en sistemas acuícolas.","PRILABSA","InStock","false","quimicos; acuicultura; prilabsa","Suplementa magnesio en el agua.; Ajusta la dureza del agua.; Mejora la osmorregulación de los organismos.; Esencial para el metabolismo acuático.","Presentación:; Sacos de 25 kg.; Almacenamiento:; Mantener en lugar seco.; Evitar la humedad.","Pureza: ≥98%; Forma: Escamas; Color: Blanco; Solubilidad: Altamente soluble en agua; Contenido de Mg: 11.8%","camarones; sales; quimicos; acuicultura; prilabsa","2025-07-19T17:20:19.839292"
"53","53","QU002","CLORURO DE POTASIO","quimicos","Sales","cloruro-de-potasio","/assets/images/productos/quimicos/QU002.png","/assets/pdfs/productos/quimicos/QU002_CLORURO_DE_POTASIO_ficha.pdf","Sal mineral para suplementación de potasio y ajuste de salinidad.","Sal mineral utilizada para suplementación de potasio y ajuste de salinidad en acuicultura.","PRILABSA","InStock","false","quimicos; acuicultura; prilabsa","Suplementa potasio en el agua.; Ajusta la salinidad del agua.; Mejora la función muscular de los organismos.; Esencial para el equilibrio electrolítico.","Presentación:; Sacos de 25 kg.; Almacenamiento:; Mantener en lugar seco.; Evitar la humedad.","Pureza: ≥99%; Forma: Cristalino; Color: Blanco; Solubilidad: Soluble en agua; Contenido de K: 52.4%","camarones; sales; quimicos; acuicultura; prilabsa","2025-07-19T17:20:19.839292"
"54","54","QU003","NITRATO DE SODIO","quimicos","Sales","nitrato-de-sodio","/assets/images/productos/quimicos/QU003.png","/assets/pdfs/productos/quimicos/QU003_PERCARBONATO_DE_SODIO_ficha.pdf","Sal mineral como fuente de nitrógeno.","Sal mineral utilizada como fuente de nitrógeno y para ajuste de parámetros químicos del agua.","PRILABSA","InStock","false","quimicos; acuicultura; prilabsa","Fuente de nitrógeno para el agua.; Estimula el crecimiento de fitoplancton.; Mejora la productividad primaria.; Ajusta parámetros químicos del agua.","Presentación:; Sacos de 25 kg.; Almacenamiento:; Mantener en lugar seco y fresco.; Evitar el contacto con materiales combustibles.","Pureza: ≥99%; Forma: Cristalino; Color: Blanco; Solubilidad: Altamente soluble en agua; Contenido de N: 16.5%","camarones; sales; quimicos; acuicultura; prilabsa","2025-07-19T17:20:19.839292"
"55","55","QU005","NITRATO SÓDICO POTÁSICO","quimicos","Sales","nitrato-sodico-potasico","/assets/images/productos/quimicos/QU005.png","/assets/pdfs/productos/quimicos/QU005_METASILICATO_DE_SODIO_ficha.pdf","Fertilizante mineral que aporta nitrógeno, sodio y potasio.","Fertilizante mineral que aporta nitrógeno, sodio y potasio para sistemas acuícolas.","PRILABSA","InStock","false","quimicos; acuicultura; prilabsa","Aporta nitrógeno y potasio.; Estimula el crecimiento de fitoplancton.; Mejora la productividad del estanque.; Fertilizante completo para acuicultura.","Presentación:; Sacos de 25 kg.; Almacenamiento:; Mantener en lugar seco y fresco.; Evitar el contacto con materiales combustibles.","Contenido de N: 15%; Contenido de K2O: 14%; Forma: Cristalino; Color: Blanco; Solubilidad: Altamente soluble en agua","camarones; sales; quimicos; acuicultura; prilabsa","2025-07-19T17:20:19.839292"
"56","56","QU016","SULFATO DE ALUMINIO (SO4)3 Al2","quimicos","Sales","sulfato-de-aluminio","/assets/images/productos/quimicos/QU016.png","/assets/pdfs/productos/quimicos/QU016_ORTHOTOLIDINE_OTO_ficha.pdf","Coagulante para clarificación de agua.","Coagulante utilizado para clarificación de agua y remoción de partículas en suspensión.","PRILABSA","InStock","false","quimicos; acuicultura; prilabsa","Efectivo coagulante para clarificación.; Remueve partículas en suspensión.; Mejora la transparencia del agua.; Reduce la turbidez.","Presentación:; Sacos de 25 kg.; Almacenamiento:; Mantener en lugar seco.; Evitar la humedad.","Pureza: ≥17% Al2O3; Forma: Escamas; Color: Blanco a gris claro; Solubilidad: Soluble en agua; pH (solución 1%): 3.0-3.5","camarones; sales; quimicos; acuicultura; prilabsa","2025-07-19T17:20:19.839292"
"57","57","QU017","THIOSULFATO DE SODIO","quimicos","Sales","thiosulfato-de-sodio","/assets/images/productos/quimicos/QU017.png","/assets/pdfs/productos/quimicos/QU017_THIOSULFATO_DE_SODIO_ficha.pdf","Agente neutralizante de cloro para decloración de agua.","Agente neutralizante de cloro utilizado para decloración de agua en sistemas acuícolas.","PRILABSA","InStock","false","quimicos; acuicultura; prilabsa","Neutraliza el cloro residual.; Decloración rápida y efectiva.; Protege a los organismos acuáticos.; Esencial para tratamiento de agua.","Presentación:; Sacos de 25 kg.; Almacenamiento:; Mantener en lugar seco.; Evitar la humedad.","Pureza: ≥99%; Forma: Cristalino; Color: Blanco; Solubilidad: Altamente soluble en agua; pH (solución 1%): 6.5-8.0","camarones; sales; quimicos; acuicultura; prilabsa","2025-07-19T17:20:19.839292"
"58","58","QU018","METASILICATO DE SODIO","quimicos","Silicatos","metasilicato-de-sodio","/assets/images/productos/quimicos/QU018.png","/assets/pdfs/productos/quimicos/QU018_REFRIGERANTE_ECOLOGICO_R507_ficha.pdf","Compuesto alcalino para ajuste de pH y limpieza.","Compuesto alcalino utilizado para ajuste de pH y como agente limpiador en sistemas acuícolas.","PRILABSA","InStock","false","quimicos; acuicultura; prilabsa","Ajusta el pH del agua.; Agente limpiador alcalino.; Remueve depósitos orgánicos.; Mejora la calidad del agua.","Presentación:; Sacos de 25 kg.; Almacenamiento:; Mantener en lugar seco.; Evitar el contacto con ácidos.","Pureza: ≥98%; Forma: Escamas; Color: Blanco; Solubilidad: Soluble en agua; pH (solución 1%): 12.5-13.0","camarones; silicatos; quimicos; acuicultura; prilabsa","2025-07-19T17:20:19.839292"
"59","59","EQ001","OXIGENÓMETRO - OAKTON 260","equipos","Oxigenometros","oxigenometro-oakton-260","/assets/images/productos/equipos/EQ001.png","/assets/pdfs/productos/equipos/EQ001_OXIGENOMETRO_-_OAKTON_260_ficha.pdf","Medidor portátil de oxígeno disuelto y temperatura con carcasa resistente IP67.","Medidor portátil de oxígeno disuelto y temperatura, diseñado con una carcasa robusta, antideslizante y resistente al agua (IP67), polvo e impactos. Su diseño ergonómico, interfaz intuitiva y funciones avanzadas lo convierten en una herramienta confiable para monitoreo en campo o laboratorio. Ideal para condiciones exigentes de campo y laboratorio con capacidad de registro de hasta 1000 datos y conectividad USB y RS-232.","PRILABSA","InStock","true","equipos; acuicultura; prilabsa; oxigenometros","Mide con precisión parámetros esenciales como OD y temperatura; Ideal para condiciones exigentes de campo y laboratorio; Permite trazabilidad de datos con su función de registro digital; Fácil de usar, transportar y configurar; Carcasa robusta resistente al agua (IP67), polvo e impactos; Conectividad USB y RS-232 para transferencia de datos","Equipo portátil con cable de 2 m, portaelectrodos y soporte plegable; No requiere refrigeración ni almacenamiento especial","Carcasa: Antideslizante y resistente (IP67); Pantalla: LCD monocromática con retroiluminación; Registro de datos: Hasta 1000 datos; Conectividad: USB y RS-232; Oxígeno disuelto: 0–20 mg/L, precisión ±0.1 mg/L; Temperatura: -30 a 130 °C, precisión ±0.5 °C; Resolución: 0.01 mg/L y 0.1 °C; Alimentación: 2 baterías AA","oxigenometros; camarones; acuicultura; equipos; prilabsa","2025-07-19T17:20:20.004031"
"60","60","EQ002","WATERLINK SPIN TOUCH","equipos","General","waterlink-spin-touch","/assets/images/productos/equipos/EQ002.png","/assets/pdfs/productos/equipos/EQ002_WATERLINK_SPIN_TOUCH_ficha.pdf","Fotómetro digital avanzado para pruebas rápidas en agua dulce y salada.","Fotómetro digital avanzado para pruebas rápidas y precisas en agua dulce y salada. Utiliza discos prellenados (SpinDisk™) para ejecutar de 8 a 10 pruebas simultáneas en solo 2 minutos con menos de 3 ml de muestra.","PRILABSA","InStock","false","equipos; acuicultura; prilabsa; general","Ahorra tiempo con resultados rápidos y confiables; Reduce errores humanos con reactivos premedidos; Facilita el control y seguimiento de calidad del agua; Mejora la toma de decisiones mediante historial y alertas","Equipo portátil con discos individuales; No requiere condiciones especiales de almacenamiento","Pruebas simultáneas: Hasta 10 en 2 minutos; Muestra requerida: < 3 ml; Tipo de disco: SpinDisk™ (descartable); Tipo de agua: Dulce y salada; Registro: Automático con fecha y hora; Conectividad: Compatible con app WaterLink® (iOS y Android)","camarones; general; acuicultura; equipos; prilabsa","2025-07-19T17:20:19.871348"
"61","61","EQ003","NEON OPTOD","equipos","Oxigenometros","neon-optod-oximetro-acuicultura","/assets/images/productos/equipos/EQ003.png","/assets/pdfs/productos/equipos/EQ003_NEON_OPTOD_ficha.pdf","Oxímetro portátil de alta precisión con sensor OPTOD para sistemas acuícolas.","Oxímetro portátil de alta precisión para medición de oxígeno disuelto y temperatura en sistemas acuícolas. Utiliza sensor OPTOD con tecnología óptica de luminiscencia, ideal para ambientes de baja circulación. Procesa, registra y transmite datos de manera eficiente con almacenamiento interno de hasta 3000 mediciones.","PRILABSA","InStock","false","equipos; acuicultura; prilabsa; oxigenometros; camarones; medicion","Lecturas confiables y precisas incluso en condiciones con baja circulación de agua; Bajo mantenimiento y operación sin consumo de oxígeno; Gestión completa de datos y usuarios directamente desde el sensor; Ideal para mediciones de campo gracias a su portabilidad y autonomía","Equipo portátil alimentado con 3 pilas AA; Incluye sensor OPTOD; Datos exportables vía WiFi; No requiere condiciones especiales de almacenamiento","Rango de Oxígeno: 0,00 – 20,00 mg/L / 0 – 200 %; Resolución: 0,01; Precisión Oxígeno: ±0,1 mg/L, ±0,1 %; Precisión Temperatura: ±0,5 °C; Almacenamiento: 3000 registros internos; Conexión: Descarga por WiFi; Alimentación: 3 pilas AA; Sensor: OPTOD óptico (cambio cada 2 años); Compensaciones: Barométrica (auto), Salinidad (manual), Temperatura (auto)","oxigenometros; camarones; acuicultura; equipos; prilabsa; sensor optod; oxigeno disuelto; medicion agua","2025-07-19T17:20:20.013545"
"62","62","EQ004","OXIGENÓMETRO OxyGuard Polaris C","equipos","Oxigenometros","oxigenometro-oxyguard-polaris-c","/assets/images/productos/equipos/EQ004.png","/assets/pdfs/productos/equipos/EQ004_ficha.pdf","Oxímetro portátil de campo con sonda galvánica para medición de oxígeno disuelto y temperatura.","Oxímetro portátil de campo con sonda galvánica que permite medir oxígeno disuelto (en mg/L y % de saturación), temperatura y compensación de salinidad. Diseñado para ambientes exigentes, ofrece gran autonomía, pantalla retroiluminada y calibración automática con ajuste a presión barométrica.","PRILABSA","InStock","false","equipos; acuicultura; prilabsa; oxigenometros","Equipamiento confiable para uso en campo y ambientes de cultivo exigentes; Lecturas precisas gracias a su compensación barométrica y de temperatura; Alta autonomía y facilidad de transporte para jornadas prolongadas; Calibración automática que simplifica el manejo y reduce errores","Dispositivo portátil con sonda galvánica; Clip desmontable, batería de 9V; Membrana y solución electrolítica incluidas","Rango de oxígeno: 0 – 60 ppm; Rango de temperatura: -5 °C a +45 °C; Longitud del cable: 3 m y 8 m disponibles; Batería: 9V con duración de hasta 1.400 horas; Altitud operación: Hasta 4000 msnm","oxigenometros; camarones; acuicultura; equipos; prilabsa","2025-07-19T17:20:19.994701"
