ID,Numero,Codigo_Producto,Nombre,Categoria,Subcategoria,Slug,Imagen,PDF_Ficha,Descripcion_Corta,Descripcion_Larga,Marca,Disponibilidad,Destacado,Tags,Beneficios,Presentacion,Especificaciones,Palabras_Clave,Fecha_Actualizacion
"82","82","EQ029","KITS API AMONIO","equipos","Kits de Análisis","kits-api-amonio","/assets/images/productos/equipos/EQ029.png","/assets/pdfs/productos/equipos/EQ029_KITS_API_AMONIO_ficha.pdf","Kit API para detección crítica de amonio tóxico.","Kit de análisis API especializado para la detección de amonio (NH4+/NH3) en sistemas acuícolas. El amonio es uno de los compuestos más tóxicos para los peces y debe monitorearse constantemente para prevenir mortalidades.","API","InStock","false","equipos; kits_analisis; api; acuicultura; prilabsa","Detección crítica de amonio altamente tóxico; Prevención de mortalidades masivas; Monitoreo esencial del ciclo del nitrógeno; Alerta temprana de problemas de filtración; Protección vital de los organismos","Kit API de emergencia; Test ultra sensible para amonio; Resultados inmediatos críticos; Esencial en todo sistema acuático","Marca: API; Componente medido: Amonio (NH4+/NH3); Toxicidad: Extremadamente alta; Método: Colorimétrico rápido","api; kits_analisis; acuicultura; equipos; prilabsa; amonio; toxicidad; mortalidad","2025-07-19T17:20:20.004581"
"83","83","EQ030","KITS API CALCIO","equipos","Kits de Análisis","kits-api-calcio","/assets/images/productos/equipos/EQ030.png","/assets/pdfs/productos/equipos/EQ030_KITS_API_CALCIO_ficha.pdf","Kit API para monitoreo de calcio esencial.","Kit de análisis API especializado para la medición de calcio (Ca+2) en sistemas acuícolas. El calcio es un mineral esencial para el desarrollo de esqueletos, caparazones y funciones metabólicas de los organismos aquáticos.","API","InStock","false","equipos; kits_analisis; api; acuicultura; prilabsa","Monitoreo de calcio para desarrollo esqueletal; Control de minerales esenciales; Optimización del crecimiento de organismos; Evaluación de calidad mineral del agua; Soporte para funciones metabólicas","Kit API especializado en calcio; Test colorimétrico preciso; Control de minerales esenciales; Fácil interpretación de resultados","Marca: API; Componente medido: Calcio (Ca+2); Importancia: Mineral esencial; Aplicaciones: Desarrollo esqueletal y metabólico","api; kits_analisis; acuicultura; equipos; prilabsa; calcio; mineral; esqueleto","2025-07-19T17:20:20.009103"
"84","84","EQ031","BALANZAS OHAUS","equipos","Balanzas","balanzas-ohaus","/assets/images/productos/equipos/EQ031.png","/assets/pdfs/productos/equipos/EQ031_BALANZAS_OHAUS_ficha.pdf","Balanzas OHAUS de diferentes dimensiones y capacidades bajo pedido.","Balanzas OHAUS de diferentes dimensiones y capacidades bajo pedido. Equipadas con pantalla LCD de alto contraste que indica claramente datos de peso y aplicaciones, así como indicadores de estabilidad, condiciones de sobrecarga y estado de las baterías.","PRILABSA","InStock","false","equipos; acuicultura; prilabsa; balanzas","Precisión en mediciones de peso; Pantalla clara con múltiples indicadores; Construcción robusta con acero inoxidable; Múltiples opciones de conectividad","Balanza Scout Pro 400 x 0.1 g; Balanza Scout Pro 600 x 0.1 g; Balanza Scout Pro 2000 x 0.1 g; Balanza Scout Pro 1200 x 0.1 g; Balanza Triple Brazo con Dial","Pantalla: LCD de alto contraste con indicadores de estabilidad; Operación: Botones para fácil operación; Platillo: Redondo o cuadrado de acero inoxidable; Gancho: Integrado para pesar por debajo de la balanza; Conectividad: USB o RS232 opcionales; Seguridad: Soporte de seguridad integral; Energía: Apagado automático","camarones; balanzas; acuicultura; equipos; prilabsa","2025-07-19T17:20:19.853317"
"85","85","EQ010","SALINÓMETRO -11","equipos","General","salinometro-11","/assets/images/productos/equipos/EQ010.png","/assets/pdfs/productos/equipos/EQ010_SALINOMETRO_-11_ficha.pdf","Salinómetro portátil de alta precisión con sensor plano.","Salinómetro portátil de alta precisión con sensor plano, ideal para mediciones rápidas y confiables de salinidad en agua de mar, soluciones nutritivas y muestras de laboratorio o campo. Diseñado con materiales resistentes, pantalla retroiluminada y tecnología de medición con electrodos bipolares, este equipo requiere solo una pequeña cantidad de muestra y ofrece lecturas claras, estables y automáticas.","PRILABSA","InStock","false","salinómetro; medición; portátil; precisión; campo; laboratorio","Ideal para mediciones rápidas y precisas con muy poco volumen de muestra; Apto para condiciones de campo exigentes gracias a su resistencia al agua, polvo y golpes; Calibración y operación sencillas, incluso para personal no técnico; Alta portabilidad, ideal para monitoreo directo de salinidad en acuicultura, alimentos, aguas residuales y más","Soluciones de calibración a 0.5% y 5.0% (14 ml c/u); Solución de tratamiento de electrodo (4 ml); 2 baterías CR2032; Pipeta; Manual de instrucciones; Estuche portátil","Protección: IP67 (agua y polvo); Pantalla: LCD monocromática con retroiluminación; Dimensiones: 164 × 29 × 20 mm; Peso: Aprox. 50 g (incluyendo baterías); Alimentación: 2 baterías CR2032; Autonomía: Aprox. 400 horas de uso continuo","salinómetro; medidor salinidad; portátil; alta precisión; IP67; acuicultura; laboratorio; PRILABSA","2025-07-19T17:20:19.876781"
"86","86","EQ011","SALINÓMETRO VEE GEE STX-3","equipos","General","salinometro-vee-gee-stx3","/assets/images/productos/equipos/EQ011.png","/assets/pdfs/productos/equipos/EQ011_SALINOMETRO_VEE_GEE_STX-3_ficha.pdf","Refractómetro manual de alta precisión para medición de salinidad.","Refractómetro manual de alta precisión diseñado para medir la concentración de sal (ppt) y la gravedad específica (GE) en agua de mar. Fabricado con materiales resistentes y equipado con compensación automática de temperatura (ATC), ofrece lecturas estables y exactas sin necesidad de alimentación eléctrica. Ideal para aplicaciones en acuicultura, laboratorios, industria alimentaria y campo.","PRILABSA","InStock","false","refractómetro; salinidad; precisión; portátil; manual; ATC","Precisión inmediata sin necesidad de energía eléctrica; Alta durabilidad y portabilidad para uso en campo o laboratorio; Medición estable gracias a su diseño ergonómico y protección térmica; Ideal para monitoreo de salinidad en acuicultura, acuarios marinos, alimentos y más","Equipo portátil; No requiere condiciones especiales de almacenamiento; Sin necesidad de alimentación eléctrica; Incluye estuche de transporte","Rango Salinidad: 0 a 100 ppt (partes por mil); Gravedad Específica: 1.000 a 1.070; Compensación Temperatura: Automática (ATC); Material: Prisma de vidrio óptico en carcasa metálica; Dimensiones: 40 × 40 × 185 mm; Diseño: Tipo telescopio aerodinámico con empuñadura de goma","refractómetro; salinómetro; VEE GEE STX-3; alta precisión; ATC; acuicultura; gravedad específica; PRILABSA","2025-07-19T17:20:19.883547"
"87","87","EQ012","TERMÓMETRO","equipos","General","termometro","/assets/images/productos/equipos/EQ012.png","/assets/pdfs/productos/equipos/EQ012_TERMOMETRO_ficha.pdf","Termómetro de vidrio amarillo para medición precisa de temperatura.","Termómetro de vidrio color amarillo diseñado para medición precisa de temperatura en aplicaciones de acuicultura y laboratorio. Fabricado en vidrio resistente con dimensiones compactas de 150 x 30 x 2mm.","PRILABSA","InStock","false","equipos; acuicultura; prilabsa; general","Medición precisa de temperatura; Diseño compacto y manejable; Material resistente de vidrio; Ideal para aplicaciones de acuicultura","Termómetro individual de vidrio amarillo; Embalaje protectivo para transporte","Color: Amarillo; Material: Vidrio; Tamaño: 150 x 30 x 2mm; Aplicación: Acuicultura y laboratorio","camarones; general; acuicultura; equipos; prilabsa","2025-07-19T17:20:19.870574"
"88","88","EQ015","AMMO LOCK","equipos","General","ammo-lock","/assets/images/productos/equipos/EQ015.png","/assets/pdfs/productos/equipos/EQ015_AMMO_LOCK_ficha.pdf","Desintoxicante que neutraliza el amonio tóxico en cultivos acuícolas.","El amonio es un compuesto tóxico para los cultivos acuícolas porque ocasiona daños severos en las branquias, problemas en la osmorregulación, desgaste en los tejidos, disminución de la tasa de crecimiento e incluso mortalidades. AMMO LOCK es un desintoxicante que tiene la capacidad de convertir el amonio en una forma no tóxica y evitar perjuicios por este compuesto dentro del estanque.","PRILABSA","InStock","false","desintoxicante; amonio; tratamiento; agua; acuicultura; seguridad","Convierte el amonio tóxico en forma no tóxica; Previene daños severos en las branquias; Evita problemas de osmorregulación; Actúa contrarrestando el efecto de cloro y cloraminas; Avalado por la Universidad de Georgia, Escuela de Medicina Veterinaria","Líquido concentrado; Envases de 16 oz; Fácil dosificación; Larga vida útil","Dosis para 10 galones: 5 mL; Dosis para 1 tonelada: 125 mL; Presentación: Líquido en envases de 16 oz; Función Principal: Conversión de amonio a forma no tóxica; Función Secundaria: Neutralización de cloro y cloraminas; Validación: Universidad de Georgia, Escuela de Medicina Veterinaria","ammo lock; desintoxicante amonio; acuicultura; neutralizador amonio; tratamiento agua; branquias; PRILABSA","2025-07-19T17:20:19.872565"
"89","89","EQ032","CÁMARA NEUBAUER","equipos","Opticos","camara-neubauer","/assets/images/productos/equipos/EQ032.png","/assets/pdfs/productos/equipos/EQ032_CAMARA_NEUBAUER_ficha.pdf","Hemocitómetro para recuento de esporas y células en medio líquido.","Cámara de Neubauer o hemocitómetro es un instrumento para realizar el recuento de esporas y células en un medio líquido. Esta cámara de recuento está adaptada al microscopio de campo claro o al de contraste de fases. Se cubre la cámara con un cubreobjetos que se adhiere por simple tensión superficial (en especial una vez que se haya añadido la muestra líquida).","PRILABSA","InStock","false","hemocitómetro; recuento; células; microscopía; laboratorio; análisis","Recuento preciso de esporas y células en medio líquido; Compatible con microscopio de campo claro o contraste de fases; Fácil adhesión del cubreobjetos por tensión superficial; Cálculo estandarizado para concentración celular","Cámara de recuento estándar; Compatible con cubreobjetos estándar; Adaptada para microscopía óptica; Incluye instrucciones de uso","Función: Recuento de esporas y células en medio líquido; Compatibilidad: Microscopio de campo claro o contraste de fases; Cálculo: Partículas/μl = (partículas contadas) / [superficie contada (mm²) × profundidad (mm)] × dilución; Cubreobjetos: Se adhiere por tensión superficial; Tipo: Cámara de recuento estándar","cámara neubauer; hemocitómetro; recuento celular; microscopía; laboratorio; esporas; células; PRILABSA","2025-07-19T17:20:19.902710"
"90","90","EQ033","TIRILLAS pH","equipos","Medidores","tirillas-ph","/assets/images/productos/equipos/EQ033.png","","Tirillas indicadoras de pH para medición rápida del nivel de acidez.","Tirillas indicadoras de pH para medición rápida y precisa del nivel de acidez en agua. Con rango de medición pH 4.5 - 10.0, son ideales para monitoreo continuo en sistemas de acuicultura y laboratorio.","PRILABSA","InStock","false","equipos; acuicultura; prilabsa; medidores","Medición rápida y precisa de pH; Rango amplio de medición 4.5-10.0; Fácil lectura por comparación colorimétrica; Ideal para monitoreo continuo en acuicultura","Tirillas en envase de plástico protectivo; Rango pH: 4.5 - 10.0","Rango pH: 4.5 - 10.0; Tipo: Tirillas indicadoras; Aplicación: Acuicultura y laboratorio; Envase: Plástico protectivo; Lectura: Inmediata por comparación colorimétrica","camarones; acuicultura; equipos; prilabsa; medidores","2025-07-19T17:20:20.033835"
"91","91","EQ034","CÁMARA SEDGEWICK","equipos","Opticos","camara-sedgewick","/assets/images/productos/equipos/EQ034.png","/assets/pdfs/productos/equipos/EQ034_CAMARA_SEDGEWICK_ficha.pdf","Cámara de recuento para partículas y microorganismos en líquidos.","Cámara de recuento Sedgewick Rafter para contar partículas y microorganismos en 1 ml de agua u otros líquidos transparentes. La cámara de 50 x 20 x 1 mm (= 1 cm³) es graduada con un retículo de 1 mm que subdivide 1 ml en 1000 μl. Es apta para el uso con microscopios convencionales y microscopios invertidos.","PRILABSA","InStock","false","sedgewick; recuento; microorganismos; plancton; microscopía; análisis","Diseñada para facilitar el recuento de grandes cantidades de zooplancton; Pequeño tamaño apto para microscopio estereoscópico; Retículo graduado para precisión en el recuento; Compatible con microscopios convencionales e invertidos; Ideal para métodos APHA y análisis de especies de plancton","Cámara de recuento de 1 cm³; Incluye cubreobjetos; Retículo graduado integrado; Compatible con múltiples tipos de microscopio","Dimensiones cámara: 50 x 20 x 1 mm (= 1 cm³); Retículo: Graduado con retículo de 1 mm; Subdivisión: 1 ml dividido en 1000 μl; Cubreobjetos: Aprox. 60 x 30 x 1 mm incluido; Compatibilidad: Microscopios convencionales e invertidos; Uso adicional: Compatible con micrómetros oculares","cámara sedgewick; sedgewick rafter; recuento microorganismos; plancton; microscopía; retículo; laboratorio; PRILABSA","2025-07-19T17:20:19.899669"
"92","92","EQ035","BLOWERS GAST","equipos","Aireacion","blowers-gast","/assets/images/productos/equipos/EQ035.png","/assets/pdfs/productos/equipos/EQ035_BLOWERS_GAST_ficha.pdf","Sopladores GAST con modelos de motor estándar para aireación.","Sopladores GAST con modelos de motor estándar diseñados para aplicaciones de aireación en acuicultura. Construcción robusta de aluminio y hierro fundido con nueva grasa de poliurea que extiende la vida del rodamiento y ofrece resistencia superior al lavado, oxidación y corrosión.","PRILABSA","InStock","false","equipos; acuicultura; prilabsa; aireacion","Construcción robusta de aluminio y hierro fundido; Nueva grasa de poliurea que extiende la vida del rodamiento; Resistencia superior al lavado, oxidación y corrosión; Motores multi-voltaje a prueba de explosiones","Diferentes modelos con motor estándar; Disponible bajo pedido específico","Tipo de motor: Motor estándar multi-voltaje; Construcción: Aluminio y hierro fundido; Protección: A prueba de explosiones; Lubricación: Grasa de poliurea de larga duración; Resistencia: Superior al lavado, oxidación y corrosión","aireacion; camarones; acuicultura; equipos; prilabsa","2025-07-19T17:20:19.887365"
"93","93","EQ036","BLOWERS ALL STAR","equipos","Aireacion","blowers-all-star","/assets/images/productos/equipos/EQ036.png","/assets/pdfs/productos/equipos/EQ036_BLOWERS_ALL_STAR_ficha.pdf","Sopladores ALL STAR de alta eficiencia para aireación.","Sopladores ALL STAR diseñados para aplicaciones de aireación en acuicultura con rendimiento de alta eficiencia. Equipados con motor AC de jaula de 2 polos IP 54 TEFC (Totalmente Cerrado Enfriado por Ventilador) y aislamiento clase H para máxima durabilidad.","PRILABSA","InStock","false","equipos; acuicultura; prilabsa; aireacion","Rendimiento de alta eficiencia; Motor AC de jaula de 2 polos IP 54 TEFC; Aislamiento clase H para máxima durabilidad; Diseño totalmente cerrado enfriado por ventilador","Diferentes modelos de alta eficiencia; Disponible bajo pedido específico","Tipo de motor: AC de jaula de 2 polos IP 54 TEFC; Aislamiento: Clase H; Rendimiento: Alta eficiencia; Protección: IP 54 - Totalmente cerrado; Enfriamiento: Enfriado por ventilador (TEFC)","aireacion; camarones; acuicultura; equipos; prilabsa","2025-07-19T17:20:19.893701"
"94","94","EQ037","PIEDRAS DIFUSORAS","equipos","Aireacion","piedras-difusoras","/assets/images/productos/equipos/EQ037.png","/assets/pdfs/productos/equipos/EQ037_PIEDRAS_DIFUSORAS_ficha.pdf","Difusores de aire cerámicos para emisión homogénea de burbujas.","Los difusores de aire son ideales para producir una emisión homogénea de pequeñas burbujas en su acuario de agua dulce o salada. Con estos difusores podrá crear columnas de burbujas sin necesitar una gran presión por parte de la bomba de aire, gracias a su estructura cerámica muy porosa.","PRILABSA","InStock","false","equipos; acuicultura; prilabsa; aireacion","Flotabilidad negativa - se mantienen en el fondo sin lastre; Estructura cerámica muy porosa para máxima eficiencia; No requieren gran presión de la bomba de aire; Químicamente inertes al agua - no alteran la química","Piedras difusoras AS15S; Piedras difusoras AS3 (5x2.5x4); Piedras difusoras AS8L (8x4x4); Bubblemac Barb #0020; Bubblemac Barb #0030; Bubblemac Barb #0020F","Material: Polímeros plásticos y cerámica de alta calidad; Propiedades químicas: Químicamente inertes al agua; Modelos: Tres modelos rectangulares disponibles; Conexión: Diámetro estándar para manguera de 4/6 mm; Flotabilidad: Negativa - se mantienen en el fondo","aireacion; camarones; acuicultura; equipos; prilabsa","2025-07-19T17:20:19.890420"
"95","95","EQ039","BOLSO FILTRANTES DE POLIPROPILENO","equipos","Filtros","bolso-filtrantes-de-polipropileno","/assets/images/productos/equipos/EQ039.png","/assets/pdfs/productos/equipos/EQ039_BOLSO_FILTRANTES_DE_POLIPROPILENO_ficha.pdf","Bolsas filtrantes de polipropileno para filtración de líquidos.","El proceso de líquidos con bolsas filtrantes funciona como un filtro de profundidad y es muy recomendable para filtrar líquidos con un gran número de partículas sólidas o gelatinosas. En un filtro de profundidad, el área disponible para la retención de sólidos no es solo la superficie del elemento de filtro, también actúa el grosor del medio filtrante a través del cual se pasa.","PRILABSA","InStock","false","filtros; bolsas; polipropileno; filtración; industrial; líquidos","Alta capacidad de retención de partículas y alto flujo; Solución económica para muchas aplicaciones de filtración de líquidos; Funciona como filtro de profundidad para máxima eficiencia; Amplia compatibilidad química; Disponible en múltiples clasificaciones de micras","Bolso filtrante corto 1 micra; Bolso filtrante largo 1 micra; Bolso filtrante corto 5 micras; Bolso filtrante largo 5 micras; Bolso filtrante largo 10 micras; Bolso filtrante largo 50 micras","Material: Polipropileno; Clasificaciones: 1 - 5 - 10 - 50 micras; Capacidad: Alta capacidad de retención; Compatibilidad: Amplia compatibilidad química; Tipo filtro: Filtro de profundidad; Ventaja principal: Alta capacidad de retención y alto flujo","bolsas filtrantes; polipropileno; filtros; filtración; alta capacidad; partículas sólidas; industrial; PRILABSA","2025-07-19T17:20:19.895942"
"96","96","EQ013","MANGUERA DE VINIL TRANSPARENTE","equipos","Accesorios","manguera-de-vinil-transparente","/assets/images/productos/equipos/EQ013.png","/assets/pdfs/productos/equipos/EQ013_MANGUERA_DE_VINIL_TRANSPARENTE_ficha.pdf","Manguera de vinil transparente aprobada por FDA.","Manguera de vinil transparente aprobada por la FDA, de muy alta calidad con un diámetro ligeramente más grande y pared más pesada que la tubería de acuario. Este tubo tiene una capacidad nominal de 36 psi a 22 °C (72 °F), ideal para aplicaciones en acuicultura y sistemas de agua.","PRILABSA","InStock","false","manguera; vinil; transparente; FDA; acuario; tubería","Aprobado por la FDA para uso en sistemas de agua; Muy alta calidad con pared más pesada que tubería estándar; Diámetro optimizado para aplicaciones de acuicultura; Capacidad nominal de 36 psi a temperatura ambiente; Transparente para fácil inspección visual del flujo","Rollos de 31 metros; Material transparente; Aprobado por FDA; Alta resistencia","Modelo: TP30HD; Longitud: 100 pies; Diámetro interior: 3/16 pulgadas; Diámetro exterior: 5/16 pulgadas; Presión: 40 PSI; Capacidad nominal: 36 psi a 22 °C (72 °F)","manguera vinil; transparente; FDA; acuicultura; tubería; 40 PSI; alta calidad; PRILABSA","2025-07-19T17:20:20.024307"
"97","97","EQ038","MANGUERA DIFUSORA","equipos","Accesorios","manguera-difusora","/assets/images/productos/equipos/EQ038.png","/assets/pdfs/productos/equipos/EQ038_MANGUERA_DIFUSORA_ficha.pdf","Manguera difusora para oxigenación de estanques acuícolas.","Para obtener un ambiente adecuado en el estanque, la manguera difusora se debe ubicar de acuerdo a la forma del mismo. En estanques circulares debe ser ubicada de forma circular en el fondo, mientras que en estanques rectangulares debe ser dividida en líneas verticales. La manguera difusora Aerotube está compuesta por un material de polietileno poroso que permite emitir micro burbujas y mantener alrededor del 90% a 95% del nivel de oxígeno en el agua.","PRILABSA","InStock","false","difusora; oxigenación; aerotube; burbujas; estanque; acuicultura","Material de polietileno poroso para durabilidad; Permite emitir micro burbujas uniformes; Mantiene 90% a 95% del nivel de oxígeno en el agua; Adaptable a estanques circulares y rectangulares; Sistema Aerotube de alta eficiencia","Venta por metro lineal; Rollos de 61 metros disponibles; Material polietileno poroso; Sistema Aerotube","Diámetro externo: 2,54 cm; Diámetro interno: 1,27 cm; Grosor de pared: 0,64 cm; Peso por metro: 0,33 kg/m; Longitud del rollo: 61 m; Peso del rollo: 20 kg; Presión de rotura: 5,62 kg/cm²; Flujo de aire: 0,037 m³/min/m","manguera difusora; aerotube; oxigenación; micro burbujas; polietileno poroso; acuicultura; estanques; PRILABSA","2025-07-19T17:20:20.028019"
"98","98","EQ040","CINTA INDUSTRIAL PRIME","equipos","Cintas","cinta-industrial-prime","/assets/images/productos/equipos/EQ040.png","/assets/pdfs/productos/equipos/EQ040_CINTA_INDUSTRIAL_PRIME_ficha.pdf","Cinta industrial negra para reparaciones temporales de liners.","La cinta industrial de color negro es fabricado con material sensible a la presión y contiene adhesivos de alta calidad, siendo ideal para las reparaciones temporales de los revestimientos tipo liners en los tanques y piscinas para acuicultura y recreación. No es sensible a altas temperaturas ambientales, ni exposición UV y a la humedad. Es de grado alimenticio, no tóxico para producción acuícola.","PRILABSA","InStock","false","cinta; industrial; reparación; liners; adhesivo; acuicultura","No es sensible a altas temperaturas ambientales, ni exposición UV y a la humedad; Es de grado alimenticio, no tóxico para producción acuícola; Alta resistencia, la cinta no se puede retirar fácilmente una vez adherido; Revestimiento antiadherente de papel para fácil aplicación; Ideal para reparaciones temporales de revestimientos tipo liners","Rollos de 10 cm x 15 m; Peso 1,4 kg por rollo; Color negro; Revestimiento antiadherente de papel","Ancho: 10 cm; Largo: 15 m; Peso estándar: 1,4 kg; Espesor del adhesivo: 0,51 mm; Temperatura óptima: Por encima de 10-15°C; Resistencia: Alta, no se retira fácilmente","cinta industrial; prime; reparación liners; grado alimenticio; acuicultura; UV resistente; adhesivo; PRILABSA","2025-07-19T17:20:20.032254"
"99","99","EQ041","MALLAS PARA PISCINAS CAMARONERAS","equipos","Mallas","mallas-para-piscinas-camaroneras","/assets/images/productos/equipos/EQ041.png","/assets/pdfs/productos/equipos/EQ041_MALLAS_PARA_PISCINAS_CAMARONERAS_ficha.pdf","Mallas sintéticas de alta resistencia para acuicultura.","Mallas sintéticas de alta resistencia diseñadas para aplicaciones en acuicultura. Fabricadas con polímeros de calidad, son resistentes a bacterias, duraderas, con protección UV y configuradas en forma rómbica para máxima eficiencia de filtrado y protección estructural.","PRILABSA","InStock","false","equipos; acuicultura; prilabsa; mallas","Alta durabilidad y resistencia mecánica; Protección contra exposición prolongada al sol gracias a su tratamiento UV; Diseño antibacteriano que previene acumulaciones nocivas; Fácil de cortar e instalar en sistemas de filtrado; Versatilidad de calibres según la necesidad del cultivo","Malla 5277: Rollos de 50 metros; Mallas 5255, 5201, 5256: Rollos de 25 metros; Peso del rollo: Aproximadamente 16,8 kg","Material: Polímero; Color: Negro; Configuración: Malla rómbica (refuerzo en modelos 5277 y 5255); Protección UV: Sí; Resistencia bacteriana: Alta; Presentaciones: Malla 5277: 1x1 mm, 5255: 3x3 mm, 5201: 4x4 mm, 5256: 6x6 mm","camarones; mallas; acuicultura; equipos; prilabsa","2025-07-19T17:20:19.861676"
"100","100","EQ042","MALLA MARINES ROJA","equipos","Mallas","malla-marines-roja","/assets/images/productos/equipos/EQ042.png","/assets/pdfs/productos/equipos/EQ042_MALLA_MARINES_ROJA_ficha.pdf","Malla marines roja especializada para acuicultura marina.","Malla specializada marines color roja diseñada para aplicaciones específicas en acuicultura marina y sistemas de filtrado. Ofrece características especiales para entornos marinos exigentes.","PRILABSA","InStock","false","equipos; acuicultura; prilabsa; mallas","Especializada para entornos marinos; Color rojo distintivo para fácil identificación; Resistente a condiciones marinas exigentes; Ideal para sistemas de filtrado especializados","Disponible bajo pedido específico; Medidas según requerimientos del cliente","Color: Roja; Tipo: Marines especializada; Aplicación: Acuicultura marina","camarones; mallas; acuicultura; equipos; prilabsa","2025-07-19T17:20:19.864832"
